{
  "schema_version": 3,
  "purpose": "receipt_verification",
  "generation": 4,
  "authority_status": "ACTIVE",
  "environment": "staging",
  "authority_instance_digest": "sha256:5104b2d3b85ddbbd44fb9e4ddc2689898232c2e6e175727c71c1ce2cb6ec9bff",
  "prior_registry_digest": "sha256:f14f779c47bbd3355cfa834b2d6d9e1e0e3a1079488f70f3caab9cf83253c43a",
  "keys": [
    {
      "key_id": "receipt-staging-98fa0160de908051",
      "algorithm": "Ed25519",
      "public_key_base64": "QefUnSikny/jxE1mWY0yHT8hXezlziIBTA9HZcLN48c=",
      "status": "active"
    }
  ],
  "registry_digest": "sha256:8e69c9165619301b02c841215ccda639ab587936ecc222c6403ffe2838a7fe77"
}
