{
  "schema_version": 3,
  "purpose": "receipt_verification",
  "generation": 1,
  "authority_status": "PENDING",
  "environment": "production",
  "authority_instance_digest": "sha256:a63f439bbf478ce25795ed2c80ed6e88ddcd344a4c8538713a20410ac58b8f8c",
  "prior_registry_digest": null,
  "keys": [],
  "registry_digest": "sha256:041b025b3e1822295fdea97c738467e2515d57b8446ad22fc2abb78d119f8c4f"
}
